{
  "$schema": "https://json-schema.org/draft/2020-12/schema",
  "$id": "https://gloamvault.dev/schemas/class.schema.json",
  "title": "Class",
  "description": "A hero class: the kit, the weapons and armor, the three schools and the ultimate (03-GAME-DESIGN §2.3, §6.1, §7.1). One file per class under content/classes/<id>.json. The 45 skills themselves live in content/skills/ and point back here by classId.",
  "type": "object",
  "properties": {
    "id": { "$ref": "common.schema.json#/$defs/id" },
    "name": { "type": "string", "minLength": 1 },
    "role": {
      "type": "string",
      "description": "One line on what the class does in a party, shown on its creation card (e.g. 'front-line tank').",
      "minLength": 1,
      "maxLength": 80
    },
    "description": { "type": "string", "minLength": 1 },
    "attributeMods": {
      "$ref": "common.schema.json#/$defs/attributeMods",
      "description": "Added to 10 + species mods at creation (§2.3). The linter checks the sum is +4."
    },
    "pool": {
      "type": "string",
      "description": "The class family's resource pool (§3.2): stamina for physical classes, mana for casters.",
      "enum": ["stamina", "mana"]
    },
    "armorFamily": { "$ref": "common.schema.json#/$defs/armorFamily" },
    "weaponTypes": {
      "type": "array",
      "description": "Weapon and off-hand types the class may equip (§6.3).",
      "items": { "$ref": "common.schema.json#/$defs/weaponType" },
      "minItems": 1,
      "uniqueItems": true
    },
    "schools": {
      "type": "array",
      "description": "Exactly three schools, each a way of playing the class (§7.1). Skills reference a school by its id.",
      "items": {
        "type": "object",
        "properties": {
          "id": { "$ref": "common.schema.json#/$defs/id" },
          "name": { "type": "string", "minLength": 1 },
          "philosophy": { "type": "string", "description": "One or two sentences on what the school is for.", "minLength": 1 }
        },
        "required": ["id", "name", "philosophy"],
        "additionalProperties": false
      },
      "minItems": 3,
      "maxItems": 3
    },
    "ultimateSkillId": {
      "$ref": "common.schema.json#/$defs/id",
      "description": "The class's one Ultimate, a Tier III skill with isUltimate true (§7.1)."
    },
    "starterKit": {
      "$ref": "common.schema.json#/$defs/idList",
      "description": "Item ids of the F-grade starter gear in the class's armor family (§2.3)."
    },
    "starterSkillIds": {
      "type": "array",
      "description": "The three Tier I skills picked at creation (§7.2).",
      "items": { "$ref": "common.schema.json#/$defs/id" },
      "minItems": 3,
      "maxItems": 3,
      "uniqueItems": true
    },
    "starterKitName": {
      "type": "string",
      "description": "What New hero calls the default kit when the class offers others (\"Sword and shield\").",
      "minLength": 1,
      "maxLength": 40
    },
    "starterKitOptions": {
      "type": "array",
      "description": "Other starter kits New hero offers beside starterKit (D-099: the Warden's spear kit, the Blade's greatsword kit; 08 §12). A kit replaces the whole starterKit list and names its own three recommended Tier I picks; a hero takes one kit.",
      "items": {
        "type": "object",
        "properties": {
          "id": { "$ref": "common.schema.json#/$defs/id" },
          "name": { "type": "string", "minLength": 1, "maxLength": 40 },
          "description": { "type": "string", "minLength": 1 },
          "starterKit": { "$ref": "common.schema.json#/$defs/idList", "description": "Item ids, as starterKit." },
          "starterSkillIds": {
            "type": "array",
            "description": "The three Tier I picks this kit recommends (each must work with the kit).",
            "items": { "$ref": "common.schema.json#/$defs/id" },
            "minItems": 3,
            "maxItems": 3,
            "uniqueItems": true
          }
        },
        "required": ["id", "name", "description", "starterKit", "starterSkillIds"],
        "additionalProperties": false
      }
    },
    "fieldSkillAffinities": {
      "type": "array",
      "description": "Field skills the class is good at (§7.6: Shade → Lockpicking, Ranger → Trap Disarm, Mender → First Aid). The bonus is added to the field skill's rank for checks.",
      "items": {
        "type": "object",
        "properties": {
          "fieldSkill": { "$ref": "common.schema.json#/$defs/fieldSkill" },
          "rankBonus": { "type": "integer", "minimum": 1, "maximum": 5 }
        },
        "required": ["fieldSkill", "rankBonus"],
        "additionalProperties": false
      },
      "uniqueItems": true
    },
    "monsterTechniqueIds": {
      "$ref": "common.schema.json#/$defs/idList",
      "description": "Skill ids of this class's monster techniques — Tier III–IV skills that only Insight while that monster uses the move (§7.5)."
    },
    "aiRuleDefault": {
      "type": "string",
      "description": "The gambit line a new hero of this class starts with (§3.6), e.g. 'IF ally HP < 40% THEN skill 2 on lowest ally; ELSE basic attack nearest'.",
      "minLength": 1
    },
    "visual": {
      "type": "object",
      "properties": {
        "gearSetId": { "$ref": "common.schema.json#/$defs/id", "description": "The starter gear set's visual id in the art pipeline." },
        "palette": {
          "type": "array",
          "description": "Class accent colours used on trims and effects.",
          "items": { "$ref": "common.schema.json#/$defs/hexColor" },
          "minItems": 1
        },
        "notes": { "type": "string", "description": "Art direction for the class silhouette." }
      },
      "required": ["gearSetId", "palette"],
      "additionalProperties": false
    },
    "pros": {
      "type": "array",
      "description": "One-line strengths for the creation card (§13).",
      "items": { "type": "string", "minLength": 1 },
      "minItems": 1,
      "maxItems": 3
    },
    "cons": {
      "type": "array",
      "description": "One-line weaknesses for the creation card (§13).",
      "items": { "type": "string", "minLength": 1 },
      "minItems": 1,
      "maxItems": 3
    }
  },
  "required": ["id", "name", "role", "description", "attributeMods", "pool", "armorFamily", "weaponTypes", "schools", "ultimateSkillId", "starterKit", "starterSkillIds", "fieldSkillAffinities", "monsterTechniqueIds", "aiRuleDefault", "visual", "pros", "cons"],
  "additionalProperties": false
}
